[
  {"event_id": "ev-request", "event_type": "REQUEST", "trace_id": "trace-1", "request_id": "req-1", "release_id": "release-1", "dataset_item_id": null, "candidate_id": null, "evidence_id": null, "claim_id": null, "citation_id": null, "tool_call_id": null, "retry_of": null, "parent_event_id": null},
  {"event_id": "ev-candidate", "event_type": "CANDIDATE", "trace_id": "trace-1", "request_id": "req-1", "release_id": "release-1", "dataset_item_id": null, "candidate_id": "cand-1", "evidence_id": null, "claim_id": null, "citation_id": null, "tool_call_id": null, "retry_of": null, "parent_event_id": "ev-request"},
  {"event_id": "ev-evidence", "event_type": "EVIDENCE", "trace_id": "trace-1", "request_id": "req-1", "release_id": "release-1", "dataset_item_id": null, "candidate_id": "cand-1", "evidence_id": "evidence-1", "claim_id": null, "citation_id": null, "tool_call_id": null, "retry_of": null, "parent_event_id": "ev-candidate"},
  {"event_id": "ev-claim", "event_type": "CLAIM", "trace_id": "trace-1", "request_id": "req-1", "release_id": "release-1", "dataset_item_id": null, "candidate_id": null, "evidence_id": null, "claim_id": "claim-1", "citation_id": null, "tool_call_id": null, "retry_of": null, "parent_event_id": "ev-request"},
  {"event_id": "ev-citation", "event_type": "CITATION", "trace_id": "trace-1", "request_id": "req-1", "release_id": "release-1", "dataset_item_id": null, "candidate_id": "cand-1", "evidence_id": "evidence-1", "claim_id": "claim-1", "citation_id": "citation-1", "tool_call_id": null, "retry_of": null, "parent_event_id": "ev-claim"},
  {"event_id": "ev-tool-1", "event_type": "TOOL_CALL", "trace_id": "trace-1", "request_id": "req-1", "release_id": "release-1", "dataset_item_id": null, "candidate_id": null, "evidence_id": null, "claim_id": null, "citation_id": null, "tool_call_id": "tool-1", "retry_of": null, "parent_event_id": "ev-request"},
  {"event_id": "ev-tool-2", "event_type": "TOOL_CALL", "trace_id": "trace-1", "request_id": "req-1", "release_id": "release-1", "dataset_item_id": null, "candidate_id": null, "evidence_id": null, "claim_id": null, "citation_id": null, "tool_call_id": "tool-2", "retry_of": "tool-1", "parent_event_id": "ev-tool-1"},
  {"event_id": "ev-fallback", "event_type": "FALLBACK", "trace_id": "trace-1", "request_id": "req-1", "release_id": "release-1", "dataset_item_id": null, "candidate_id": null, "evidence_id": null, "claim_id": null, "citation_id": null, "tool_call_id": null, "retry_of": null, "parent_event_id": "ev-tool-2"},
  {"event_id": "ev-rollback", "event_type": "ROLLBACK", "trace_id": "trace-1", "request_id": "req-1", "release_id": "release-1", "dataset_item_id": null, "candidate_id": null, "evidence_id": null, "claim_id": null, "citation_id": null, "tool_call_id": null, "retry_of": null, "parent_event_id": "ev-fallback"}
]
